<!ELEMENT employees (employee+)>
<!ELEMENT employee (id, name, department, salary, email)>
<!ELEMENT id (#PCDATA)>
<!ELEMENT name (#PCDATA)>
<!ELEMENT department (#PCDATA)>
<!ELEMENT salary (#PCDATA)>
<!ELEMENT email (#PCDATA)>
